,YEAR,TITLE,ABSTRACT,KEYWORDS,AUTHORS,VENUE,JOURNAL or Conference,DOI,URL,CIT,E1,E2,E3,E4,I1,I2,I3,Included?,Researcher,Metric,Notes,,,,,,,Old ID
27,2024,Automatic semantic augmentation of language model prompts (for code summarization),"Large Language Models (LLM) are a new class of computation engines, ""programmed"" via prompt engineering. Researchers are still learning how to best ""program"" these LLMs to help developers. We start with the intuition that developers tend to consciously and unconsciously collect semantics facts, from the code, while working. Mostly these are shallow, simple facts arising from a quick read. For a function, such facts might include parameter and local variable names, return expressions, simple pre- and post-conditions, and basic control and data flow, etc.
One might assume that the powerful multi-layer architecture of transformer-style LLMs makes them implicitly capable of doing this simple level of ""code analysis"" and extracting such information, while processing code: but are they, really? If they aren't, could explicitly adding this information help? Our goal here is to investigate this question, using the code summarization task and evaluate whether automatically augmenting an LLM's prompt with semantic facts explicitly, actually helps.
Prior work shows that LLM performance on code summarization benefits from embedding a few code & summary exemplars in the prompt, before the code to be summarized. While summarization performance has steadily progressed since the early days, there is still room for improvement: LLM performance on code summarization still lags its performance on natural-language tasks like translation and text summarization.
We find that adding semantic facts to the code in the prompt actually does help! This approach improves performance in several different settings suggested by prior work, including for three different Large Language Models. In most cases, we see improvements, as measured by a range of commonly-used metrics; for the PHP language in the challenging CodeSearchNet dataset, this augmentation actually yields performance surpassing 30 BLEU1. In addition, we have also found that including semantic facts yields a substantial enhancement in LLMs' line completion performance.","LLM, Code Summarization, Program Analysis, Prompt Engineering, LLM4SE ","T Ahmed, KS Pai, P Devanbu, E Barr",,,,https://dl.acm.org/doi/abs/10.1145/3597503.3639183,1,FALSE,FALSE,FALSE,FALSE,TRUE,TRUE,TRUE,TRUE,,"BLEU, ROUGE-L, Meteor","Uses ,BLEU, ROUGE-L, Meteor",,,,,,,
28,2024,Lost in translation: A study of bugs introduced by large language models while translating code,"Code translation aims to convert source code from one programming language (PL) to another. Given the promising abilities of large language models (LLMs) in code synthesis, researchers are exploring their potential to automate code translation. The prerequisite for advancing the state of LLM-based code translation is to understand their promises and limitations over existing techniques. To that end, we present a large-scale empirical study to investigate the ability of general LLMs and code LLMs for code translation across pairs of different languages, including C, C++, Go, Java, and Python. Our study, which involves the translation of 1,700 code samples from three benchmarks and two real-world projects, reveals that LLMs are yet to be reliably used to automate code translation---with correct translations ranging from 2.1% to 47.3% for the studied LLMs. Further manual investigation of unsuccessful translations identifies 15 categories of translation bugs. We also compare LLM-based code translation with traditional non-LLM-based approaches. Our analysis shows that these two classes of techniques have their own strengths and weaknesses. Finally, insights from our study suggest that providing more context to LLMs during translation can help them produce better results. To that end, we propose a prompt-crafting approach based on the symptoms of erroneous translations; this improves the performance of LLM-based code translation by 5.5% on average. Our study is the first of its kind, in terms of scale and breadth, that provides insights into the current limitations of LLMs in code translation and opportunities for improving them. Our dataset---consisting of 1,700 code samples in five PLs with 10K+ tests, 43K+ translated code, 1,748 manually labeled bugs, and 1,365 bug-fix pairs---can help drive research in this area.","code translation, bug taxonomy, llm, LLM4SE","R Pan, AR Ibrahimzada, R Krishna, D Sankar‚Ä¶",,,,https://dl.acm.org/doi/abs/10.1145/3597503.3639226,4,FALSE,FALSE,FALSE,FALSE,TRUE,TRUE,TRUE,FALSE,,3.1 describes/mentions metrics and why they didn't choose them. But I don't see them describing anything else. so its a maybe ,3.1 describes/mentions metrics and why they didn't choose them. But I don't see them describing anything else. so its a maybe ,,,,,,,
29,2024,Using LLMs in software requirements specifications: an empirical evaluation,"The creation of a Software Requirements Specification (SRS) document is important for any software development project. Given the recent prowess of Large Language Models (LLMs) in answering natural language queries and generating sophisticated textual outputs, our study explores their capability to produce accurate, coherent, and structured drafts of these documents to accelerate the software development lifecycle. We assess the performance of GPT-4 and CodeLlama in drafting an SRS for a university club management system and compare it against human benchmarks using eight distinct criteria. Our results suggest that LLMs can match the output quality of an entry-level software engineer to generate an SRS, delivering complete and consistent drafts. We also evaluate the capabilities of LLMs to identify and rectify problems in a given requirements document. Our experiments indicate that GPT-4 is capable of identifying issues and giving constructive feedback for rectifying them, while CodeLlama's results for validation were not as encouraging. We repeated the generation exercise for four distinct use cases to study the time saved by employing LLMs for SRS generation. The experiment demonstrates that LLMs may facilitate a significant reduction in development time for entry-level software engineers. Hence, we conclude that the LLMs can be gainfully used by software engineers to increase productivity by saving time and effort in generating, validating and rectifying software requirements.","Requirements engineering, software requirements specifications, empirical research, large language models, LLM4SE","M Krishna, B Gaur, A Verma‚Ä¶",,,,https://ieeexplore.ieee.org/abstract/document/10628461/,12,FALSE,FALSE,FALSE,FALSE,FALSE,TRUE,TRUE,FALSE,,Used human annotators,Used human annotators,,,,,,,
30,2025,Swe-rl: Advancing llm reasoning via reinforcement learning on open software evolution,"The recent DeepSeek-R1 release has demonstrated the immense potential of reinforcement learning (RL) in enhancing the general reasoning capabilities of large language models (LLMs). While DeepSeek-R1 and other follow-up work primarily focus on applying RL to competitive coding and math problems, this paper introduces SWE-RL, the first approach to scale RL-based LLM reasoning for real-world software engineering. Leveraging a lightweight rule-based reward (e.g., the similarity score between ground-truth and LLM-generated solutions), SWE-RL enables LLMs to autonomously recover a developer's reasoning processes and solutions by learning from extensive open-source software evolution data -- the record of a software's entire lifecycle, including its code snapshots, code changes, and events such as issues and pull requests. Trained on top of Llama 3, our resulting reasoning model, Llama3-SWE-RL-70B, achieves a 41.0% solve rate on SWE-bench Verified -- a human-verified collection of real-world GitHub issues. To our knowledge, this is the best performance reported for medium-sized (<100B) LLMs to date, even comparable to leading proprietary LLMs like GPT-4o. Surprisingly, despite performing RL solely on software evolution data, Llama3-SWE-RL has even emerged with generalized reasoning skills. For example, it shows improved results on five out-of-domain tasks, namely, function coding, library use, code reasoning, mathematics, and general language understanding, whereas a supervised-finetuning baseline even leads to performance degradation on average. Overall, SWE-RL opens up a new direction to improve the reasoning capabilities of LLMs through reinforcement learning on massive software engineering data. ",,"Y Wei, O Duchenne, J Copet, Q Carbonneaux‚Ä¶",,,,https://arxiv.org/abs/2502.18449,3,FALSE,FALSE,FALSE,FALSE,FALSE,TRUE,TRUE,FALSE,,,,,,,,,,
31,2023,Text-to-sql empowered by large language models: A benchmark evaluation,"Large language models (LLMs) have emerged as a new paradigm for Text-to-SQL task. However, the absence of a systematical benchmark inhibits the development of designing effective, efficient and economic LLM-based Text-to-SQL solutions. To address this challenge, in this paper, we first conduct a systematical and extensive comparison over existing prompt engineering methods, including question representation, example selection and example organization, and with these experimental results, we elaborate their pros and cons. Based on these findings, we propose a new integrated solution, named DAIL-SQL, which refreshes the Spider leaderboard with 86.6% execution accuracy and sets a new bar. To explore the potential of open-source LLM, we investigate them in various scenarios, and further enhance their performance with supervised fine-tuning. Our explorations highlight open-source LLMs' potential in Text-to-SQL, as well as the advantages and disadvantages of the supervised fine-tuning. Additionally, towards an efficient and economic LLM-based Text-to-SQL solution, we emphasize the token efficiency in prompt engineering and compare the prior studies under this metric. We hope that our work provides a deeper understanding of Text-to-SQL with LLMs, and inspires further investigations and broad applications. ",LLM4SE,"D Gao, H Wang, Y Li, X Sun, Y Qian, B Ding‚Ä¶",,,,https://arxiv.org/abs/2308.15363,10,FALSE,FALSE,FALSE,FALSE,TRUE,TRUE,TRUE,TRUE,,"Exact Match, Execution Accuracy","Exact Match, Execution Accuracy",,,,,,,
32,2024,Core: Resolving code quality issues using llms,"As software projects progress, quality of code assumes paramount importance as it affects reliability, maintainability and security of software. For this reason, static analysis tools are used in developer workflows to flag code quality issues. However, developers need to spend extra efforts to revise their code to improve code quality based on the tool findings. In this work, we investigate the use of (instruction-following) large language models (LLMs) to assist developers in revising code to resolve code quality issues. We present a tool, CORE (short for COde REvisions), architected using a pair of LLMs organized as a duo comprised of a proposer and a ranker. Providers of static analysis tools recommend ways to mitigate the tool warnings and developers follow them to revise their code. The proposer LLM of CORE takes the same set of recommendations and applies them to generate candidate code revisions. The candidates which pass the static quality checks are retained. However, the LLM may introduce subtle, unintended functionality changes which may go un-detected by the static analysis. The ranker LLM evaluates the changes made by the proposer using a rubric that closely follows the acceptance criteria that a developer would enforce. CORE uses the scores assigned by the ranker LLM to rank the candidate revisions before presenting them to the developer. We conduct a variety of experiments on two public benchmarks to show the ability of CORE: (1) to generate code revisions acceptable to both static analysis tools and human reviewers (the latter evaluated with user study on a subset of the Python benchmark), (2) to reduce human review efforts by detecting and eliminating revisions with unintended changes, (3) to readily work across multiple languages (Python and Java), static analysis tools (CodeQL and SonarQube) and quality checks (52 and 10 checks, respectively), and (4) to achieve fix rate comparable to a rule-based automated program repair tool but with much smaller engineering efforts (on the Java benchmark). CORE could revise 59.2% Python files (across 52 quality checks) so that they pass scrutiny by both a tool and a human reviewer. The ranker LLM reduced false positives by 25.8% in these cases. CORE produced revisions that passed the static analysis tool in 76.8% Java files (across 10 quality checks) comparable to 78.3% of a specialized program repair tool, with significantly much less engineering efforts. We release code, data, and supplementary material publicly at http://aka.ms/COREMSRI.",• Software and its engineering → Software maintenance tools; Automatic programming. LLM4SE,"N Wadhwa, J Pradhan, A Sonwane, SP Sahu‚Ä¶",,,,https://dl.acm.org/doi/abs/10.1145/3643762,3,FALSE,FALSE,FALSE,FALSE,FALSE,TRUE,TRUE,FALSE,,"There seems to be some mention of metrics but it is unclear, since it seems to rely on metrics from the benchmarks used without describing them properly.","There seems to be some mention of metrics but it is unclear, since it seems to rely on metrics from the benchmarks used without describing them properly.",,,,,,,
33,2023,Evaluating and explaining large language models for code using syntactic structures,"Large Language Models (LLMs) for code are a family of high-parameter, transformer-based neural networks pre-trained on massive datasets of both natural and programming languages. These models are rapidly being employed in commercial AI-based developer tools, such as GitHub CoPilot. However, measuring and explaining their effectiveness on programming tasks is a challenging proposition, given their size and complexity. The methods for evaluating and explaining LLMs for code are inextricably linked. That is, in order to explain a model's predictions, they must be reliably mapped to fine-grained, understandable concepts. Once this mapping is achieved, new methods for detailed model evaluations are possible. However, most current explainability techniques and evaluation benchmarks focus on model robustness or individual task performance, as opposed to interpreting model predictions.
To this end, this paper introduces ASTxplainer, an explainability method specific to LLMs for code that enables both new methods for LLM evaluation and visualizations of LLM predictions that aid end-users in understanding model predictions. At its core, ASTxplainer provides an automated method for aligning token predictions with AST nodes, by extracting and aggregating normalized model logits within AST structures. To demonstrate the practical benefit of ASTxplainer, we illustrate the insights that our framework can provide by performing an empirical evaluation on 12 popular LLMs for code using a curated dataset of the most popular GitHub projects. Additionally, we perform a user study examining the usefulness of an ASTxplainer-derived visualization of model predictions aimed at enabling model users to explain predictions. The results of these studies illustrate the potential for ASTxplainer to provide insights into LLM effectiveness, and aid end-users in understanding predictions. ","explainability, interpretability, large language
models, dl4se, LLM4SE","DN Palacio, A Velasco, D Rodriguez-Cardenas‚Ä¶",,,,https://arxiv.org/abs/2308.03873,0,FALSE,FALSE,FALSE,FALSE,FALSE,TRUE,TRUE,FALSE,,Extremely complex metrics that make it hard to understand.,Extremely complex metrics that make it hard to understand.,,,,,,,
34,2024,Generating domain models from natural language text using NLP: a benchmark dataset and experimental comparison of tools,"Software requirements specification describes users’ needs and expectations on some target system. Requirements documents are typically represented by unstructured natural language text. Such texts are the basis for the various subsequent activities in software development, such as software analysis and design. As part of software analysis, domain models are made that describe the key concepts and relations between them. Since the analysis process is performed manually by business analysts, it is time-consuming and may introduce mistakes. Recently, researchers have worked toward automating the synthesis of domain models from textual software requirements. Current studies on this topic have limitations in terms of the volume and heterogeneity of experimental datasets. To remedy this, we provide a curated dataset of software requirements to be utilized as a benchmark by algorithms that transform textual requirements documents into domain models. We present a detailed evaluation of two text-to-model approaches: one based on a large-language model (ChatGPT) and one building on grammatical rules (txt2Model). Our evaluation reveals that both tools yield promising results with relatively high F-scores for modeling the classes, attributes, methods, and relationships, with txt2Model performing better than ChatGPT on average. Both tools have relatively lower performance and high variance when it comes to the relation types. We believe our dataset and experimental evaluation pave to way to advance the field of automated model generation from requirements.",Software functional requirements · Software models · Text-to-model transformation · Benchmark dataset,"F Bozyigit, T Bardakci, A Khalilipour‚Ä¶",,,,https://link.springer.com/article/10.1007/s10270-024-01176-y,,FALSE,FALSE,FALSE,FALSE,FALSE,TRUE,TRUE,FALSE,,,,,,,,,,
35,2023,Automated program repair in the era of large pre-trained language models,"Automated Program Repair (APR) aims to help developers automatically patch software bugs. However, current state-of-the-art traditional and learning-based APR techniques face the problem of limited patch variety, failing to fix complicated bugs. This is mainly due to the reliance on bug-fixing datasets to craft fix templates (traditional) or directly predict potential patches (learning-based). Large Pre-Trained Language Models (LLMs), trained using billions of text/code tokens, can potentially help avoid this issue. Very recently, researchers have directly leveraged LLMs for APR without relying on any bug-fixing datasets. Meanwhile, such existing work either failed to include state-of-the-art LLMs or was not evaluated on realistic datasets. Thus, the true power of modern LLMs on the important APR problem is yet to be revealed. In this work, we perform the first extensive study on directly applying LLMs for APR. We select 9 recent state-of-the-art LLMs, including both generative and infilling models, ranging from 125M to 20B in size. We designed 3 different repair settings to evaluate the different ways we can use LLMs to generate patches: 1) generate the entire patch function, 2) fill in a chunk of code given the prefix and suffix 3) output a single line fix. We apply the LLMs under these repair settings on 5 datasets across 3 different languages and compare different LLMs in the number of bugs fixed, generation speed and compilation rate. We also compare the LLMs against recent state-of-the-art APR tools. Our study demonstrates that directly applying state-of-the-art LLMs can already substantially outperform all existing APR techniques on all our datasets. Among the studied LLMs, the scaling effect exists for APR where larger models tend to achieve better performance. Also, we show for the first time that suffix code after the buggy line (adopted in infilling-style APR) is important in not only generating more fixes but more patches with higher compilation rate. Besides patch generation, the LLMs consider correct patches to be more natural than other ones, and can even be leveraged for effective patch ranking or patch correctness checking. Lastly, we show that LLM-based APR can be further substantially boosted via: 1) increasing the sample size, and 2) incorporating fix template information.",LLM4SE,"CS Xia, Y Wei, L Zhang",,,,https://ieeexplore.ieee.org/abstract/document/10172803/,,FALSE,FALSE,FALSE,FALSE,FALSE,TRUE,TRUE,FALSE,,"I believe they are doing human checks to see semantic similarity of a patch, which is not interesting for the LR","I believe they are doing human checks to see semantic similarity of a patch, which is not interesting for the LR",,,,,,,
36,2024,Codefuse-13b: A pretrained multi-lingual code large language model,"Code Large Language Models (Code LLMs) have gained significant attention in the industry due to their wide applications in the full lifecycle of software engineering. However, the effectiveness of existing models in understanding non-English inputs for multi-lingual code-related tasks is still far from well studied. This paper introduces CodeFuse-13B, an open-sourced pre-trained code LLM 2. It is specifically designed for code-related tasks with both English and Chinese prompts and supports over 40 programming languages. CodeFuse achieves its effectiveness by utilizing a high-quality pre-training dataset that is carefully filtered by program analyzers and optimized during the training process. Extensive experiments are conducted using real-world usage scenarios, the industry-standard benchmark HumanEval-x, and the specially designed CodefuseEval for Chinese prompts. To assess the effectiveness of CodeFuse, we actively collected valuable human feedback from the AntGroup's software development process where CodeFuse has been successfully deployed. The results demonstrate that CodeFuse-13B achieves a HumanEval pass@1 score of 37.10%, positioning it as one of the top multi-lingual code LLMs with similar parameter sizes. In practical scenarios, such as code generation, code translation, code comments, and testcase generation, CodeFuse performs better than other models when confronted with Chinese prompts.",Software and its engineering,"P Di, J Li, H Yu, W Jiang, W Cai, Y Cao‚Ä¶",,,,https://dl.acm.org/doi/abs/10.1145/3639477.3639719,,FALSE,FALSE,FALSE,FALSE,FALSE,TRUE,TRUE,FALSE,,,,,,,,,,
37,2022,Few-shot training llms for project-specific code-summarization,"Very large language models (LLMs), such as GPT-3 and Codex have achieved state-of-the-art performance on several natural-language tasks, and show great promise also for code. A particularly exciting aspect of LLMs is their knack for few-shot and zero-shot learning: they can learn to perform a task with very few examples. Few-shotting has particular synergies in software engineering, where there are a lot of phenomena (identifier names, APIs, terminology, coding patterns) that are known to be highly project-specific. However, project-specific data can be quite limited, especially early in the history of a project; thus the few-shot learning capacity of LLMs might be very relevant. In this paper, we investigate the use few-shot training with the very large GPT (Generative Pre-trained Transformer) Codex model, and find evidence suggesting that one can significantly surpass state-of-the-art models for code-summarization, leveraging project-specific training.","deep learning, code summarization, large language model","T Ahmed, P Devanbu",,,,https://dl.acm.org/doi/abs/10.1145/3551349.3559555,,FALSE,FALSE,FALSE,FALSE,FALSE,TRUE,TRUE,FALSE,,,,,,,,,,
38,2023,Codescope: An execution-based multilingual multitask multidimensional benchmark for evaluating llms on code understanding and generation,"Large Language Models (LLMs) have demonstrated remarkable performance on assisting humans in programming and facilitating programming automation. However, existing benchmarks for evaluating the code understanding and generation capacities of LLMs suffer from severe limitations. First, most benchmarks are insufficient as they focus on a narrow range of popular programming languages and specific tasks, whereas real-world software development scenarios show a critical need to implement systems with multilingual and multitask programming environments to satisfy diverse requirements. Second, most benchmarks fail to consider the actual executability and the consistency of execution results of the generated code. To bridge these gaps between existing benchmarks and expectations from practical applications, we introduce CodeScope, an execution-based, multilingual, multitask, multidimensional evaluation benchmark for comprehensively measuring LLM capabilities on coding tasks. CodeScope covers 43 programming languages and eight coding tasks. It evaluates the coding performance of LLMs from three dimensions (perspectives): length, difficulty, and efficiency. To facilitate execution-based evaluations of code generation, we develop MultiCodeEngine, an automated code execution engine that supports 14 programming languages. Finally, we systematically evaluate and analyze eight mainstream LLMs and demonstrate the superior breadth and challenges of CodeScope for evaluating LLMs on code understanding and generation tasks compared to other benchmarks. The CodeScope benchmark and code are publicly available at this https URL. ",LLM4SE,"W Yan, H Liu, Y Wang, Y Li, Q Chen, W Wang‚Ä¶",,,,https://arxiv.org/abs/2311.08588,,FALSE,FALSE,FALSE,FALSE,TRUE,TRUE,TRUE,TRUE,,"pass@k, BLEU, ROUGE, Meteor, Coverage Percentage","They use a bunch, pass@k, BLEU, ROUGE, Meteor, coverage percentage ",,,,,,,
