,YEAR,TITLE,ABSTRACT,KEYWORDS,AUTHORS,VENUE,JOURNAL or Conference,DOI,URL,CIT,E1,E2,E3,E4,I1,I2,I3,Included?,Researcher,Metric,Notes,,,,,,,Old ID
66,2024,A benchmark to understand the role of knowledge graphs on large language model's accuracy for question answering on enterprise SQL databases,"Enterprise applications of Large Language Models (LLMs) hold promise for question answering on enterprise SQL databases. However, the extent to which LLMs can accurately respond to enterprise questions in such databases remains unclear, given the absence of suitable Text-to-SQL benchmarks tailored to enterprise settings. Additionally, the potential of Knowledge Graphs (KGs) to enhance LLM-based question answering by providing business context is not well understood. This study aims to evaluate the accuracy of LLM-powered question answering systems in the context of enterprise questions and SQL databases, while also exploring the role of knowledge graphs in improving accuracy. To achieve this, we introduce a benchmark comprising an enterprise SQL schema in the insurance domain, a range of enterprise queries encompassing reporting to metrics, and a contextual layer incorporating an ontology and mappings that define a knowledge graph. Our primary finding reveals that question answering using GPT-4, with zero-shot prompts directly on SQL databases, achieves an accuracy of 16%. Notably, this accuracy increases to 54% when questions are posed over a Knowledge Graph representation of the enterprise SQL database. Therefore, investing in Knowledge Graph provides higher accuracy for LLM powered question answering systems.",LLM4SE,"J Sequeda, D Allemang, B Jacob",,,,https://dl.acm.org/doi/abs/10.1145/3661304.3661901,,FALSE,FALSE,FALSE,FALSE,TRUE,TRUE,TRUE,FALSE,,No describtion of metric,No describtion of metric,,,,,,,
67,2025,On the effectiveness of large language models in domain-specific code generation,"Large language models (LLMs) such as ChatGPT have shown remarkable capabilities in code generation. Despite significant achievements, they rely on enormous training data to acquire a broad spectrum of open-domain knowledge. Besides, their evaluation revolves around open-domain benchmarks like HumanEval, which primarily consist of programming contests. Therefore, it is hard to fully characterize the intricacies and challenges associated with particular domains (e.g., Web, game, and math). In this article, we conduct an in-depth study of the LLMs in domain-specific code generation. Our results demonstrate that LLMs exhibit sub-optimal performance in generating domain-specific code, due to their limited proficiency in utilizing domain-specific libraries. We further observe that incorporating API knowledge as prompts can empower LLMs to generate more professional code. Based on these findings, we further investigate how to effectively incorporate API knowledge into the code generation process. We experiment with three strategies for incorporating domain knowledge, namely, external knowledge inquirer, chain-of-thought prompting, and chain-of-thought fine-tuning. We refer to these strategies as a new code generation approach called DomCoder. Experimental results show that all strategies of DomCoder improve the effectiveness of domain-specific code generation under certain settings.","Software and its engineering → Automatic programming;
Additional Key Words and Phrases: large language models, code generation, domain-specific program
generation. LLM4SE","X Gu, M Chen, Y Lin, Y Hu, H Zhang, C Wan‚Ä¶",,,,https://dl.acm.org/doi/abs/10.1145/3697012,,FALSE,FALSE,FALSE,FALSE,TRUE,TRUE,TRUE,TRUE,,"BLEU, CodeBLEU",BLEU and CodeBLEU,,,,,,,
68,2024,Cloudeval-yaml: A practical benchmark for cloud configuration generation,"Among the thriving ecosystem of cloud computing and the proliferation of Large Language Model (LLM)-based code generation tools, there is a lack of benchmarking for code generation in cloud-native applications. In response to this need, we present CloudEval-YAML, a practical benchmark for cloud configuration generation. CloudEval-YAML tackles the diversity challenge by focusing on YAML, the de facto standard of numerous cloud-native tools. We develop the CloudEval-YAML benchmark with practicality in mind: the dataset consists of hand-written problems with unit tests targeting practical scenarios. We further enhanced the dataset to meet practical needs by rephrasing questions in a concise, abbreviated, and bilingual manner. The dataset consists of 1011 problems that take more than 1200 human hours to complete. To improve practicality during evaluation, we build a scalable evaluation platform for CloudEval-YAML that achieves a 20 times speedup over a single machine. To the best of our knowledge, the CloudEval-YAML dataset is the first hand-written dataset targeting cloud-native applications. We present an in-depth evaluation of 12 LLMs, leading to a deeper understanding of the problems and LLMs, as well as effective methods to improve task performance and reduce cost.",LLM4SE,"Y Xu, Y Chen, X Zhang, X Lin, P Hu‚Ä¶",,,,https://proceedings.mlsys.org/paper_files/paper/2024/hash/554e056fe2b6d9fd27ffcd3367ae1267-Abstract-Conference.html,,FALSE,FALSE,FALSE,FALSE,TRUE,TRUE,TRUE,TRUE,,"BLEU, Edit Distance, Exact Match, Key-Value Exact Match, Key-Value Wildcard Match, Unit Test",BLEU and a bunch of others,,,,,,,
69,2024,On evaluating the efficiency of source code generated by llms,"Recent years have seen the remarkable capabilities of large language models (LLMs) for code generation. Different from existing work that evaluate the correctness of the code generated by LLMs, we propose to further evaluate its efficiency. More efficient code can lead to higher performance and execution efficiency of programs and software completed by LLM-assisted programming. First, we evaluate the efficiency of the code generated by LLMs on two benchmarks, HumanEval and MBPP. Then, we choose a set of programming problems from the online judge platform LeetCode to conduct a more difficult evaluation. Finally, we explore several prompts that would enable LLMs to generate more efficient code.",LLM4SE,"C Niu, T Zhang, C Li, B Luo, V Ng",,,,https://dl.acm.org/doi/abs/10.1145/3650105.3652295,,FALSE,FALSE,FALSE,FALSE,TRUE,TRUE,TRUE,TRUE,,pass@k,"pass@k, LeetCodeEval beats score",,,,,,,
70,2024,Chatunitest: A framework for llm-based test generation,"Unit testing is an essential yet frequently arduous task. Various automated unit test generation tools have been introduced to mitigate this challenge. Notably, methods based on large language models (LLMs) have garnered considerable attention and exhibited promising results in recent years. Nevertheless, LLM-based tools encounter limitations in generating accurate unit tests. This paper presents ChatUniTest, an LLM-based automated unit test generation framework. ChatUniTest incorporates an adaptive focal context mechanism to encompass valuable context in prompts and adheres to a generation-validation-repair mechanism to rectify errors in generated unit tests. Subsequently, we have developed ChatUniTest Core, a common library that implements core workflow, complemented by the ChatUniTest Toolchain, a suite of seamlessly integrated tools enhancing the capabilities of ChatUniTest. Our effectiveness evaluation reveals that ChatUniTest outperforms TestSpark and EvoSuite in half of the evaluated projects, achieving the highest overall line coverage. Furthermore, insights from our user study affirm that ChatUniTest delivers substantial value to various stakeholders in the software testing domain. ChatUniTest is available at https://github.com/ZJU-ACES-ISE/ChatUniTest, and the demo video is available at https://www.youtube.com/watch?v=GmfxQUqm2ZQ.","Large Language Models, Automatic Unit Testing Generation, LLM4SE","Y Chen, Z Hu, C Zhi, J Han, S Deng, J Yin",,,,https://dl.acm.org/doi/abs/10.1145/3663529.3663801,,FALSE,FALSE,FALSE,FALSE,FALSE,TRUE,TRUE,FALSE,,Might be interesting for thesis,Might be interesting for thesis,,,,,,,
71,2023,Competition-level problems are effective llm evaluators,"Large language models (LLMs) have demonstrated impressive reasoning capabilities, yet there is ongoing debate about these abilities and the potential data contamination problem recently. This paper aims to evaluate the reasoning capacities of LLMs, specifically in solving recent competition-level programming problems in Codeforces, which are expert-crafted and unique, requiring deep understanding and robust reasoning skills. We first provide a comprehensive evaluation of GPT-4's peiceived zero-shot performance on this task, considering various aspects such as problems' release time, difficulties, and types of errors encountered. Surprisingly, the peiceived performance of GPT-4 has experienced a cliff like decline in problems after September 2021 consistently across all the difficulties and types of problems, which shows the potential data contamination, as well as the challenges for any existing LLM to solve unseen complex reasoning problems. We further explore various approaches such as fine-tuning, Chain-of-Thought prompting and problem description simplification, unfortunately none of them is able to consistently mitigate the challenges. Through our work, we emphasis the importance of this excellent data source for assessing the genuine reasoning capabilities of LLMs, and foster the development of LLMs with stronger reasoning abilities and better generalization in the future. ",LLM4SE,"Y Huang, Z Lin, X Liu, Y Gong, S Lu, F Lei‚Ä¶",,,,https://arxiv.org/abs/2312.02143,,FALSE,FALSE,FALSE,FALSE,TRUE,TRUE,TRUE,TRUE,,"pass@k, ACC","pass@k, ACC",,,,,,,
72,2024,Livecodebench: Holistic and contamination free evaluation of large language models for code,"Large Language Models (LLMs) applied to code-related applications have emerged as a prominent field, attracting significant interest from both academia and industry. However, as new and improved LLMs are developed, existing evaluation benchmarks (e.g., HumanEval, MBPP) are no longer sufficient for assessing their capabilities. In this work, we propose LiveCodeBench, a comprehensive and contamination-free evaluation of LLMs for code, which continuously collects new problems over time from contests across three competition platforms, namely LeetCode, AtCoder, and CodeForces. Notably, our benchmark also focuses on a broader range of code related capabilities, such as self-repair, code execution, and test output prediction, beyond just code generation. Currently, LiveCodeBench hosts four hundred high-quality coding problems that were published between May 2023 and May 2024. We have evaluated 18 base LLMs and 34 instruction-tuned LLMs on LiveCodeBench. We present empirical findings on contamination, holistic performance comparisons, potential overfitting in existing benchmarks as well as individual model comparisons. We will release all prompts and model completions for further community analysis, along with a general toolkit for adding new scenarios and model ",LLM4SE,"N Jain, K Han, A Gu, WD Li, F Yan, T Zhang‚Ä¶",,,,https://arxiv.org/abs/2403.07974,,FALSE,FALSE,FALSE,FALSE,TRUE,TRUE,TRUE,TRUE,,pass@k,pass@k,,,,,,,
73,2024,Agentharm: A benchmark for measuring harmfulness of llm agents,"The robustness of LLMs to jailbreak attacks, where users design prompts to circumvent safety measures and misuse model capabilities, has been studied primarily for LLMs acting as simple chatbots. Meanwhile, LLM agents -- which use external tools and can execute multi-stage tasks -- may pose a greater risk if misused, but their robustness remains underexplored. To facilitate research on LLM agent misuse, we propose a new benchmark called AgentHarm. The benchmark includes a diverse set of 110 explicitly malicious agent tasks (440 with augmentations), covering 11 harm categories including fraud, cybercrime, and harassment. In addition to measuring whether models refuse harmful agentic requests, scoring well on AgentHarm requires jailbroken agents to maintain their capabilities following an attack to complete a multi-step task. We evaluate a range of leading LLMs, and find (1) leading LLMs are surprisingly compliant with malicious agent requests without jailbreaking, (2) simple universal jailbreak templates can be adapted to effectively jailbreak agents, and (3) these jailbreaks enable coherent and malicious multi-step agent behavior and retain model capabilities. To enable simple and reliable evaluation of attacks and defenses for LLM-based agents, we publicly release AgentHarm at this https URL. ",,"M Andriushchenko, A Souly, M Dziemian‚Ä¶",,,,https://arxiv.org/abs/2410.09024,,FALSE,FALSE,FALSE,FALSE,FALSE,TRUE,TRUE,FALSE,,,,,,,,,,
74,2023,Is your code generated by chatgpt really correct? rigorous evaluation of large language models for code generation,"Program synthesis has been long studied with recent approaches focused on directly using the power of Large Language Models (LLMs) to generate code. Programming benchmarks, with curated synthesis problems and test-cases, are used to measure the performance of various LLMs on code synthesis. However, these test-cases can be limited in both quantity and quality for fully assessing the functional correctness of the generated code. Such limitation in the existing benchmarks begs the following question: In the era of LLMs, is the code generated really correct? To answer this, we propose EvalPlus – a code synthesis evaluation framework to rigorously benchmark the functional correctness of LLM-synthesized code. EvalPlus augments a given evaluation dataset with large amounts of test-cases newly produced by an automatic test input generator, powered by both LLM- and mutation-based strategies. While EvalPlus is general, we extend the test-cases of the popular HumanEval benchmark by 80x to build HumanEval+. Our extensive evaluation across 26 popular LLMs (e.g., GPT-4 and ChatGPT) demonstrates that HumanEval+ is able to catch significant amounts of previously undetected wrong code synthesized by LLMs, reducing the pass@k by up-to 19.3-28.9%. We also surprisingly found that test insufficiency can lead to mis-ranking. For example, both WizardCoder-CodeLlama and Phind-CodeLlama now outperform ChatGPT on HumanEval+, while none of them could on HumanEval. Our work not only indicates that prior popular code synthesis evaluation results do not accurately reflect the true performance of LLMs for code synthesis, but also opens up a new direction to improve such programming benchmarks through automated testing. We have open-sourced our tools, enhanced datasets as well as all LLM-generated code at https://github.com/evalplus/evalplus to facilitate and accelerate future LLM-for-code research.
",LLM4SE,"J Liu, CS Xia, Y Wang, L Zhang",,,,https://proceedings.neurips.cc/paper_files/paper/2023/hash/43e9d647ccd3e4b7b5baab53f0368686-Abstract-Conference.html,,FALSE,FALSE,FALSE,FALSE,TRUE,TRUE,TRUE,TRUE,,pass@k,pass@k,,,,,,,
75,2023,Impact of large language models on generating software specifications,"Software specifications are essential for many Software Engineering (SE) tasks such as bug detection and test generation. Many existing approaches are proposed to extract the specifications defined in natural language form (e.g., comments) into formal machine readable form (e.g., first order logic). However, existing approaches suffer from limited generalizability and require manual efforts. The recent emergence of Large Language Models (LLMs), which have been successfully applied to numerous SE tasks, offers a promising avenue for automating this process. In this paper, we conduct the first empirical study to evaluate the capabilities of LLMs for generating software specifications from software comments or documentation. We evaluate LLMs performance with Few Shot Learning (FSL) and compare the performance of 13 state of the art LLMs with traditional approaches on three public datasets. In addition, we conduct a comparative diagnosis of the failure cases from both LLMs and traditional methods, identifying their unique strengths and weaknesses. Our study offers valuable insights for future research to improve specification generation. ","software specifications, large language models,
few-shot learning, LLM4SE","D Xie, B Yoo, N Jiang, M Kim, L Tan, X Zhang‚Ä¶",,,,https://arxiv.org/abs/2306.03324,,TRUE,FALSE,FALSE,FALSE,TRUE,TRUE,TRUE,FALSE,,"recall, precision, F1-score","recall, precision, F1-score",,,,,,,
76,2024,Understanding the weakness of large language model agents within a complex android environment,"Large language models (LLMs) have empowered intelligent agents to execute intricate tasks within domain-specific software such as browsers and games. However, when applied to general-purpose software systems like operating systems, LLM agents face three primary challenges. Firstly, the action space is vast and dynamic, posing difficulties for LLM agents to maintain an up-to-date understanding and deliver accurate responses. Secondly, real-world tasks often require inter-application cooperation, demanding farsighted planning from LLM agents. Thirdly, agents need to identify optimal solutions aligning with user constraints, such as security concerns and preferences. These challenges motivate AndroidArena, an environment and benchmark designed to evaluate LLM agents on a modern operating system. To address high-cost of manpower, we design a scalable and semi-automated method to construct the benchmark. In the task evaluation, AndroidArena incorporates accurate and adaptive metrics to address the issue of non-unique solutions. Our findings reveal that even state-of-the-art LLM agents struggle in cross-APP scenarios and adhering to specific constraints. Additionally, we identify a lack of four key capabilities, i.e. understanding, reasoning, exploration, and reflection, as primary reasons for the failure of LLM agents. Furthermore, we provide empirical analysis on the failure of reflection, and improve the success rate by 27% with our proposed exploration strategy. This work is the first to present valuable insights in understanding fine-grained weakness of LLM agents, and offers a path forward for future research in this area. Environment, benchmark, prompt, and evaluation code for AndroidArena are released at https://github.com/AndroidArenaAgent/AndroidArena.","Large Language Model; AI Agent; Task Planning, LLM4SE","M Xing, R Zhang, H Xue, Q Chen, F Yang‚Ä¶",,,,https://dl.acm.org/doi/abs/10.1145/3637528.3671650,,TRUE,FALSE,FALSE,FALSE,TRUE,TRUE,TRUE,FALSE,,It describes metrics for agents and not for general LLM usage,It describes metrics for agents and not for general LLM usage,,,,,,,
77,2024,Experimenting a new programming practice with llms,"The recent development on large language models makes automatically constructing small programs possible. It thus has the potential to free software engineers from low-level coding and allow us to focus on the perhaps more interesting parts of software development, such as requirement engineering and system testing. In this project, we develop a prototype named AISD (AI-aided Software Development), which is capable of taking high-level (potentially vague) user requirements as inputs, generates detailed use cases, prototype system designs, and subsequently system implementation. Different from existing attempts, AISD is designed to keep the user in the loop, i.e., by repeatedly taking user feedback on use cases, high-level system designs, and prototype implementations through system testing. AISD has been evaluated with a novel benchmark of non-trivial software projects. The experimental results suggest that it might be possible to imagine a future where software engineering is reduced to requirement engineering and system testing only. ","Requirement engineering, system testing, large language model,
code generation, LLM4SE","S Zhang, J Wang, G Dong, J Sun, Y Zhang‚Ä¶",,,,https://arxiv.org/abs/2401.01062,,TRUE,FALSE,FALSE,FALSE,FALSE,TRUE,TRUE,FALSE,,Statistical,Statistical,,,,,,,
78,2023,Owl: A large language model for it operations,"With the rapid development of IT operations, it has become increasingly crucial to efficiently manage and analyze large volumes of data for practical applications. The techniques of Natural Language Processing (NLP) have shown remarkable capabilities for various tasks, including named entity recognition, machine translation and dialogue systems. Recently, Large Language Models (LLMs) have achieved significant improvements across various NLP downstream tasks. However, there is a lack of specialized LLMs for IT operations. In this paper, we introduce the OWL, a large language model trained on our collected OWL-Instruct dataset with a wide range of IT-related information, where the mixture-of-adapter strategy is proposed to improve the parameter-efficient tuning across different domains or tasks. Furthermore, we evaluate the performance of our OWL on the OWL-Bench established by us and open IT-related benchmarks. OWL demonstrates superior performance results on IT tasks, which outperforms existing models by significant margins. Moreover, we hope that the findings of our work will provide more insights to revolutionize the techniques of IT operations with specialized LLMs. ",LLM4SE,"H Guo, J Yang, J Liu, L Yang, L Chai, J Bai‚Ä¶",,,,https://arxiv.org/abs/2309.09298,,TRUE,FALSE,FALSE,FALSE,TRUE,TRUE,TRUE,FALSE,,Statistical,Statistical,,,,,,,
79,2024,Greening large language models of code,"Large language models of code have shown remarkable effectiveness across various software engineering tasks. Despite the availability of many cloud services built upon these powerful models, there remain several scenarios where developers cannot take full advantage of them, stemming from factors such as restricted or unreliable internet access, institutional privacy policies that prohibit external transmission of code to third-party vendors, and more. Therefore, developing a compact, efficient, and yet energy-saving model for deployment on developers' devices becomes essential.
To this aim, we propose Avatar, a novel approach that crafts a deployable model from a large language model of code by optimizing it in terms of model size, inference latency, energy consumption, and carbon footprint while maintaining a comparable level of effectiveness (e.g., prediction accuracy on downstream tasks). The key idea of Avatar is to formulate the optimization of language models as a multi-objective configuration tuning problem and solve it with the help of a Satisfiability Modulo Theories (SMT) solver and a tailored optimization algorithm. The SMT solver is used to form an appropriate configuration space, while the optimization algorithm identifies the Pareto-optimal set of configurations for training the optimized models using knowledge distillation. We evaluate Avatar with two popular language models of code, i.e., CodeBERT and GraphCodeBERT, on two popular tasks, i.e., vulnerability prediction and clone detection. We use Avatar to produce optimized models with a small size (3 MB), which is 160× smaller than the original large models. On the two tasks, the optimized models significantly reduce the energy consumption (up to 184× less), carbon footprint (up to 157× less), and inference latency (up to 76× faster), with only a negligible loss in effectiveness (1.67%).","Language Models of Code, Configuration Tuning, Multi-Objective
Optimization, LLM4SE","J Shi, Z Yang, HJ Kang, B Xu, J He, D Lo",,,,https://dl.acm.org/doi/abs/10.1145/3639475.3640097,,FALSE,FALSE,FALSE,FALSE,FALSE,TRUE,TRUE,FALSE,,,,,,,,,,
80,2023,On the evaluation of neural code translation: Taxonomy and benchmark,"In recent years, neural code translation has gained increasing attention. While most of the research focuses on improving model architectures and training processes, we notice that the evaluation process and benchmark for code translation models are severely limited: they primarily treat source code as natural languages and provide a holistic accuracy score while disregarding the full spectrum of model capabilities across different translation types and complexity. In this paper, we present a comprehensive investigation of four state-of-the-art models and analyze in-depth the advantages and limitations of three existing benchmarks. Based on the empirical results, we develop a taxonomy that categorizes code translation tasks into four primary types according to their complexity and knowledge dependence: token level (type 1), syntactic level (type 2), library level (type 3), and algorithm level (type 4). We then conduct a thorough analysis of how existing approaches perform across these four categories. Our findings indicate that while state-of-the-art code translation models excel in type-1 and type-2 translations, they struggle with knowledge-dependent ones such as type-3 and type-4. Existing benchmarks are biased towards trivial translations, such as keyword mapping. To overcome these limitations, we construct G-TransEval, a new benchmark by manually curating type-3 and type-4 translation pairs and unit test cases. Results on our new benchmark suggest that G-TransEval can exhibit more comprehensive and finer-grained capability of code translation models and thus provide a more rigorous evaluation. Our studies also provide more insightful findings and suggestions for future research, such as building type-3 and type-4 training data and ensembling multiple pretraining approaches.","Code Translation, Empirical Study, Benchmark,
Evaluation, LLM4SE","M Jiao, T Yu, X Li, G Qiu, X Gu‚Ä¶",,,,https://ieeexplore.ieee.org/abstract/document/10298408/,,FALSE,FALSE,FALSE,FALSE,FALSE,TRUE,TRUE,FALSE,,,,,,,,,,
