,YEAR,TITLE,ABSTRACT,KEYWORDS,AUTHORS,VENUE,JOURNAL or Conference,DOI,URL,CIT,E1,E2,E3,E4,I1,I2,I3,Included?,Researcher,Metric,Notes,,,,,,,Old ID
1,2024,Efficient and green large language models for software engineering: Vision and the road ahead,"Large Language Models (LLMs) have recently shown remarkable capabilities in various software engineering tasks, spurring the rapid growth of the Large Language Models for Software Engineering (LLM4SE) area. However, limited attention has been paid to developing efficient LLM4SE techniques that demand minimal computational cost, time, and memory resources, as well as green LLM4SE solutions that reduce energy consumption, water usage, and carbon emissions. This paper aims to redirect the focus of the research community towards the efficiency and greenness of LLM4SE, while also sharing potential research directions to achieve this goal. It commences with a brief overview of the significance of LLM4SE and highlights the need for efficient and green LLM4SE solutions. Subsequently, the paper presents a vision for a future where efficient and green LLM4SE revolutionizes the LLM-based software engineering tool landscape, benefiting various stakeholders, including industry, individual practitioners, and society. The paper then delineates a roadmap for future research, outlining specific research paths and potential solutions for the research community to pursue. While not intended to be a definitive guide, the paper aims to inspire further progress, with the ultimate goal of establishing efficient and green LLM4SE as a central element in the future of software engineering.",General and reference → Surveys and overviews; • Software and its engineering → Software development techniques; • Computing methodologies → Artificial intelligence,"J Shi, Z Yang, D Lo",ACM Transactions on Software Engineering and Methodology (TOSEM),,,https://dl.acm.org/doi/abs/10.1145/3708525,13,FALSE,FALSE,FALSE,FALSE,FALSE,TRUE,TRUE,FALSE,,,generic,,,,,,,
2,2024,Agentless: Demystifying llm-based software engineering agents,"Recent advancements in large language models (LLMs) have significantly advanced the automation of software development tasks, including code synthesis, program repair, and test generation. More recently, researchers and industry practitioners have developed various autonomous LLM agents to perform end-to-end software development tasks. These agents are equipped with the ability to use tools, run commands, observe feedback from the environment, and plan for future actions. However, the complexity of these agent-based approaches, together with the limited abilities of current LLMs, raises the following question: Do we really have to employ complex autonomous software agents? To attempt to answer this question, we build Agentless -- an agentless approach to automatically solve software development problems. Compared to the verbose and complex setup of agent-based approaches, Agentless employs a simplistic three-phase process of localization, repair, and patch validation, without letting the LLM decide future actions or operate with complex tools. Our results on the popular SWE-bench Lite benchmark show that surprisingly the simplistic Agentless is able to achieve both the highest performance (32.00%, 96 correct fixes) and low cost ($0.70) compared with all existing open-source software agents! Furthermore, we manually classified the problems in SWE-bench Lite and found problems with exact ground truth patch or insufficient/misleading issue descriptions. As such, we construct SWE-bench Lite-S by excluding such problematic issues to perform more rigorous evaluation and comparison. Our work highlights the current overlooked potential of a simple, interpretable technique in autonomous software development. We hope Agentless will help reset the baseline, starting point, and horizon for autonomous software agents, and inspire future work along this crucial direction. ",LLM4SE,"CS Xia, Y Deng, S Dunn, L Zhang",,,,https://arxiv.org/abs/2407.01489,3,FALSE,FALSE,FALSE,FALSE,FALSE,TRUE,TRUE,FALSE,,,"report, this wasn't included because it didn't meet the inclusion criteria of being focused on benchmarking but on LLM agents and they use the SWE benchmark",,,,,,,
3,2025,Revisiting sentiment analysis for software engineering in the era of large language models,"Software development involves collaborative interactions where stakeholders express opinions across various platforms. Recognizing the sentiments conveyed in these interactions is crucial for the effective development and ongoing maintenance of software systems. For software products, analyzing the sentiment of user feedback, e.g., reviews, comments, and forum posts can provide valuable insights into user satisfaction and areas for improvement. This can guide the development of future updates and features. However, accurately identifying sentiments in software engineering datasets remains challenging.
This study investigates bigger large language models (bLLMs) in addressing the labeled data shortage that hampers fine-tuned smaller large language models (sLLMs) in software engineering tasks. We conduct a comprehensive empirical study using five established datasets to assess three open source bLLMs in zero-shot and few-shot scenarios. Additionally, we compare them with fine-tuned sLLMs, using sLLMs to learn contextual embeddings of text from software platforms.
Our experimental findings demonstrate that bLLMs exhibit state-of-the-art performance on datasets marked by limited training data and imbalanced distributions. bLLMs can also achieve excellent performance under a zero-shot setting. However, when ample training data are available or the dataset exhibits a more balanced distribution, fine-tuned sLLMs can still achieve superior results.",Software and its engineering → Maintaining software;,"T Zhang, IC Irsan, F Thung, D Lo",,,,https://dl.acm.org/doi/abs/10.1145/3697009,0,FALSE,FALSE,FALSE,FALSE,FALSE,TRUE,TRUE,FALSE,,,,,,,,,,
4,2025,Towards an understanding of large language models in software engineering tasks,"Large Language Models (LLMs) have drawn widespread attention and research due to their astounding performance in text generation and reasoning tasks. Derivative products, like ChatGPT, have been extensively deployed and highly sought after. Meanwhile, the evaluation and optimization of LLMs in software engineering tasks, such as code generation, have become a research focus. However, there is still a lack of systematic research on applying and evaluating LLMs in software engineering. Therefore, this paper comprehensively investigate and collate the research and products combining LLMs with software engineering, aiming to answer two questions: (1) What are the current integrations of LLMs with software engineering? (2) Can LLMs effectively handle software engineering tasks? To find the answers, we have collected related literature as extensively as possible from seven mainstream databases and selected 123 timely papers published starting from 2022 for analysis. We have categorized these papers in detail and reviewed the current research status of LLMs from the perspective of seven major software engineering tasks, hoping this will help researchers better grasp the research trends and address the issues when applying LLMs. Meanwhile, we have also organized and presented papers with evaluation content to reveal the performance and effectiveness of LLMs in various software engineering tasks, guiding researchers and developers to optimize.","Empirical study· Literature review· Large language models· Software Engineering, LLM4SE","Z Zheng, K Ning, Q Zhong, J Chen, W Chen‚Ä¶",,,,https://link.springer.com/article/10.1007/s10664-024-10602-0,3,FALSE,FALSE,FALSE,FALSE,FALSE,TRUE,TRUE,FALSE,,,"generic, Didn't meet inclusion criteria 1",,,,,,,
5,2024,Evocodebench: An evolving code generation benchmark with domain-specific evaluations,"How to evaluate Large Language Models (LLMs) in code generation remains an open question. Many benchmarks have been proposed, but they have two limitations, i.e., data leakage and lack of domain-specific evaluation.The former hurts the fairness of benchmarks, and the latter hinders practitioners from selecting superior LLMs for specific programming domains.To address these two limitations, we propose a new benchmark - EvoCodeBench, which has the following advances: (1) Evolving data. EvoCodeBench will be dynamically updated every period (e.g., 6 months) to avoid data leakage. This paper releases the first version - EvoCodeBench-2403, containing 275 samples from 25 repositories.(2) A domain taxonomy and domain labels. Based on the statistics of open-source communities, we design a programming domain taxonomy consisting of 10 popular domains. Based on the taxonomy, we annotate each sample in EvoCodeBench with a domain label. EvoCodeBench provides a broad platform for domain-specific evaluations.(3) Domain-specific evaluations. Besides the Pass@k, we compute the Domain-Specific Improvement (DSI) and define LLMs' comfort and strange domains. These evaluations help practitioners select superior LLMs in specific domains and discover the shortcomings of existing LLMs.Besides, EvoCodeBench is collected by a rigorous pipeline and aligns with real-world repositories in multiple aspects (e.g., code distributions).We evaluate 8 popular LLMs (e.g., gpt-4, DeepSeek Coder, StarCoder 2) on EvoCodeBench and summarize some insights. EvoCodeBench reveals the actual abilities of these LLMs in real-world repositories. For example, the highest Pass@1 of gpt-4 on EvoCodeBench-2403 is only 20.74%. Besides, we evaluate LLMs in different domains and discover their comfort and strange domains. For example, gpt-4 performs best in most domains but falls behind others in the Internet domain. StarCoder 2-15B unexpectedly performs well in the Database domain and even outperforms 33B LLMs. We release EvoCodeBench, all prompts, and LLMs' completions for further community analysis.",LLM4SE,"J Li, G Li, X Zhang, Y Zhao, Y Dong‚Ä¶",,,,https://proceedings.neurips.cc/paper_files/paper/2024/hash/6a059625a6027aca18302803743abaa2-Abstract-Datasets_and_Benchmarks_Track.html,3,FALSE,FALSE,FALSE,FALSE,TRUE,TRUE,TRUE,TRUE,,pass@k,pass@k,,,,,,,
6,2024,JavaBench: A Benchmark of Object-Oriented Code Generation for Evaluating Large Language Models,"Code generation benchmarks such as HumanEval are widely adopted to evaluate LLMs’ capabilities. However, after consolidating the
latest 24 benchmarks, we noticed three significant imbalances. First, imbalanced programming language. 95.8% of benchmarks in-
volve Python, while only 5 benchmarks involve Java, resulting in an insufficient understanding of LLMs’ capability to generate Java
code. Second, imbalanced code granularity. Function-/statement-level benchmarks account for over 83.3% of benchmarks. Only a
mere handful extends to class-/project-levels, and all are limited to Python. Third, lacking advanced features. Existing benchmarks
primarily assess basic coding skills (e.g., variables, operators, and control structures), while overlooking advanced Object-Oriented
Programming (OOP) features (i.e., encapsulation, inheritance, and polymorphism). Considering the prevalence of these advanced fea-
tures in real-world Java project development, constructing benchmarks to test LLMs on handling OOP features is necessary.
To fill these gaps, we propose JavaBench, a project-level Java benchmark that exercises OOP features. It comprises four Java
projects with 389 methods in 106 Java classes. The test coverage is up to 92%, and JavaBench is attested by 282 undergraduate students,
reaching a 90.93/100 average score (i.e., pass rate against the test suite), ensuring the quality of documentation, code skeleton, and
tests. To better evaluate LLM’s capability against JavaBench, we introduce a systematic evaluation design covering three context set-
tings and five synthesis strategies at two granularities using three hierarchical metrics. Our extensive experiment yields several inter-
esting findings. First, we noticed that regarding project-level Java programming, LLMs are far behind undergraduate students",LLM4SE,"J Cao, Z Chen, J Wu, SC Cheung, C Xu",,,,https://dl.acm.org/doi/abs/10.1145/3691620.3695470,0,FALSE,FALSE,FALSE,FALSE,TRUE,TRUE,TRUE,TRUE,,pass@k,"pass@k, Java",,,,,,,
7,2023,Large language models are few-shot testers: Exploring llm-based general bug reproduction,"Many automated test generation techniques have been developed to aid developers with writing tests. To facilitate full automation, most existing techniques aim to either increase coverage, or generate exploratory inputs. However, existing test generation techniques largely fall short of achieving more semantic objectives, such as generating tests to reproduce a given bug report. Reproducing bugs is nonetheless important, as our empirical study shows that the number of tests added in open source repositories due to issues was about 28% of the corresponding project test suite size. Meanwhile, due to the difficulties of transforming the expected program semantics in bug reports into test oracles, existing failure reproduction techniques tend to deal exclusively with program crashes, a small subset of all bug reports. To automate test generation from general bug reports, we propose Libro, a framework that uses Large Language Models (LLMs), which have been shown to be capable of performing code-related tasks. Since LLMs themselves cannot execute the target buggy code, we focus on post-processing steps that help us discern when LLMs are effective, and rank the produced tests according to their validity. Our evaluation of Libro shows that, on the widely studied Defects4J benchmark, Libro can generate failure reproducing test cases for 33% of all studied cases (251 out of 750), while suggesting a bug reproducing test in first place for 149 bugs. To mitigate data contamination (i.e., the possibility of the LLM simply remembering the test code either partially or in whole), we also evaluate Libro against 31 bug reports submitted after the collection of the LLM training data terminated: Libro produces bug reproducing tests for 32% of the studied bug reports. Overall, our results show Libro has the potential to significantly enhance developer efficiency by automatically generating tests from bug reports.",LLM4SE,"S Kang, J Yoon, S Yoo",,,,https://ieeexplore.ieee.org/abstract/document/10172763/,2,FALSE,FALSE,FALSE,FALSE,TRUE,TRUE,TRUE,TRUE,,,framework,,,,,,,
8,2023,"Large language model assisted software engineering: prospects, challenges, and a case study","Large language models such as OpenAI’s GPT and Google’s Bard offer new opportunities for supporting software engineering processes. Large language model assisted software engineering promises to support developers in a conversational way with expert knowledge over the whole software lifecycle. Current applications range from requirements extraction, ambiguity resolution, code and test case generation, code review and translation to verification and repair of software vulnerabilities. In this paper we present our position on the potential benefits and challenges associated with the adoption of language models in software engineering. In particular, we focus on the possible applications of large language models for requirements engineering, system design, code and test generation, code quality reviews, and software process management. We also give a short review of the state-of-the-art of large language model support for software construction and illustrate our position by a case study on the object-oriented development of a simple “search and rescue” scenario.",LLM4SE,"L Belzner, T Gabor, M Wirsing",,,,https://link.springer.com/chapter/10.1007/978-3-031-46002-9_23,5,FALSE,FALSE,FALSE,FALSE,FALSE,TRUE,TRUE,FALSE,,,,,,,,,,
9,2024,"Top leaderboard ranking= top coding proficiency, always? evoeval: Evolving coding benchmarks via llm","LLMs have become the go-to choice for code generation tasks, with an exponential increase in the training, development, and usage of LLMs specifically for code generation. To evaluate the ability of LLMs on code, both academic and industry practitioners rely on popular handcrafted benchmarks. However, prior benchmarks contain only a very limited set of problems, both in quantity and variety. Further, due to popularity and age, many benchmarks are prone to data leakage where example solutions can be readily found on the web and thus potentially in training data. Such limitations inevitably lead us to inquire: Is the leaderboard performance on existing benchmarks reliable and comprehensive enough to measure the program synthesis ability of LLMs? To address this, we introduce EvoEval -- a program synthesis benchmark suite created by evolving existing benchmarks into different targeted domains for a comprehensive evaluation of LLM coding abilities. Our study on 51 LLMs shows that compared to the high performance obtained on standard benchmarks like HumanEval, there is a significant drop in performance (on average 39.4%) when using EvoEval. Additionally, the decrease in performance can range from 19.6% to 47.7%, leading to drastic ranking changes amongst LLMs and showing potential overfitting of existing benchmarks. Furthermore, we showcase various insights, including the brittleness of instruction-following models when encountering rewording or subtle changes as well as the importance of learning problem composition and decomposition. EvoEval not only provides comprehensive benchmarks, but can be used to further evolve arbitrary problems to keep up with advances and the ever-changing landscape of LLMs for code. We have open-sourced our benchmarks, tools, and complete LLM generations at this https URL",LLM4SE,"CS Xia, Y Deng, L Zhang",,,,https://arxiv.org/abs/2403.19114,,FALSE,FALSE,FALSE,FALSE,TRUE,TRUE,TRUE,TRUE,,pass@k,pass@k,,,,,,,
10,2024,Multitask-based evaluation of open-source llm on software vulnerability,"This paper proposes a pipeline for quantitatively evaluating interactive Large Language Models (LLMs) using publicly available datasets. We carry out an extensive technical evaluation of LLMs using Big-Vul covering four different common software vulnerability tasks. This evaluation assesses the multi-tasking capabilities of LLMs based on this dataset. We find that the existing state-of-the-art approaches and pre-trained Language Models (LMs) are generally superior to LLMs in software vulnerability detection. However, in software vulnerability assessment and location, certain LLMs (e.g., CodeLlama and WizardCoder) have demonstrated superior performance compared to pre-trained LMs, and providing more contextual information can enhance the vulnerability assessment capabilities of LLMs. Moreover, LLMs exhibit strong vulnerability description capabilities, but their tendency to produce excessive output significantly weakens their performance compared to pre-trained LMs. Overall, though LLMs perform well in some aspects, they still need improvement in understanding the subtle differences in code vulnerabilities and the ability to describe vulnerabilities to fully realize their potential. Our evaluation pipeline provides valuable insights into the capabilities of LLMs in handling software vulnerabilities.","Software vulnerability analysis, large language
model, LLM4SE","X Yin, C Ni, S Wang",,,,https://ieeexplore.ieee.org/abstract/document/10706805/,368,FALSE,FALSE,FALSE,FALSE,TRUE,TRUE,TRUE,TRUE,,"F1-score, Recall, Precision, Accuracy, acc@k,  FPR metrics, ROUGE-1, ROUGE-2, ROUGE-L","F1-score, Recall, Precision, Accuracy, acc@k,  FPR metrics, ROUGE-1, ROUGE-2, ROUGE-L",,,,,,,
11,2022,On the validity of pre-trained transformers for natural language processing in the software engineering domain,"Transformers are the current state-of-the-art of natural language processing in many domains and are using traction within software engineering research as well. Such models are pre-trained on large amounts of data, usually from the general domain. However, we only have a limited understanding regarding the validity of transformers within the software engineering domain, i.e., how good such models are at understanding words and sentences within a software engineering context and how this improves the state-of-the-art. Within this article, we shed light on this complex, but crucial issue. We compare BERT transformer models trained with software engineering data with transformers based on general domain data in multiple dimensions: their vocabulary, their ability to understand which words are missing, and their performance in classification tasks. Our results show that for tasks that require understanding of the software engineering context, pre-training with software engineering data is valuable, while general domain models are sufficient for general language understanding, also within the software engineering domain.",LLM4SE,"J Von der Mosel, A Trautsch‚Ä¶",,,,https://ieeexplore.ieee.org/abstract/document/9785808/,8,FALSE,FALSE,FALSE,FALSE,FALSE,TRUE,TRUE,FALSE,,,"generic, and I don't see any relevant metrics. Metrics used seem to be focused on statistics",,,,,,,
12,2024,Can LLMs replace manual annotation of software engineering artifacts?,"Experimental evaluations of software engineering innovations, e.g., tools and processes, often include human-subject studies as a component of a multi-pronged strategy to obtain greater generalizability of the findings. However, human-subject studies in our field are challenging, due to the cost and difficulty of finding and employing suitable subjects, ideally, professional programmers with varying degrees of experience. Meanwhile, large language models (LLMs) have recently started to demonstrate human-level performance in several areas. This paper explores the possibility of substituting costly human subjects with much cheaper LLM queries in evaluations of code and code-related artifacts. We study this idea by applying six state-of-the-art LLMs to ten annotation tasks from five datasets created by prior work, such as judging the accuracy of a natural language summary of a method or deciding whether a code change fixes a static analysis warning. Our results show that replacing some human annotation effort with LLMs can produce inter-rater agreements equal or close to human-rater agreement. To help decide when and how to use LLMs in human-subject studies, we propose model-model agreement as a predictor of whether a given task is suitable for LLMs at all, and model confidence as a means to select specific samples where LLMs can safely replace human annotators. Overall, our work is the first step toward mixed human-LLM evaluations in software engineering. ","LLMs, human subjects, evaluation, LLM4SE","T Ahmed, P Devanbu, C Treude, M Pradel",,,,https://arxiv.org/abs/2408.05534,1,TRUE,FALSE,FALSE,FALSE,TRUE,TRUE,TRUE,FALSE,,human annotators,human annotators,,,,,,,
13,2023,Prompt engineering or fine tuning: An empirical assessment of large language models in automated software engineering tasks,"The rapid advancements in large language models (LLMs) have greatly expanded the potential for automated code-related tasks. Two primary methodologies are used in this domain: prompt engineering and fine-tuning. Prompt engineering involves applying different strategies to query LLMs, like ChatGPT, while fine-tuning further adapts pre-trained models, such as CodeBERT, by training them on task-specific data. Despite the growth in the area, there remains a lack of comprehensive comparative analysis between the approaches for code models. In this paper, we evaluate GPT-4 using three prompt engineering strategies -- basic prompting, in-context learning, and task-specific prompting -- and compare it against 17 fine-tuned models across three code-related tasks: code summarization, generation, and translation. Our results indicate that GPT-4 with prompt engineering does not consistently outperform fine-tuned models. For instance, in code generation, GPT-4 is outperformed by fine-tuned models by 28.3% points on the MBPP dataset. It also shows mixed results for code translation tasks. Additionally, a user study was conducted involving 27 graduate students and 10 industry practitioners. The study revealed that GPT-4 with conversational prompts, incorporating human feedback during interaction, significantly improved performance compared to automated prompting. Participants often provided explicit instructions or added context during these interactions. These findings suggest that GPT-4 with conversational prompting holds significant promise for automated code-related tasks, whereas fully automated prompt engineering without human involvement still requires further investigation. ","Prompt engineering, Fine-tuning, LLM4SE,
Empirical study, Survey","J Shin, C Tang, T Mohati, M Nayebi, S Wang‚Ä¶",,,,https://arxiv.org/abs/2310.10508,7,FALSE,FALSE,FALSE,FALSE,TRUE,TRUE,TRUE,TRUE,,"BLEU, pass@k, Human Annotators","BLEU, pass@k, human annotators",,,,,,,
